{
  "schemaVersion": 1,
  "product": "client",
  "version": "1.0.0",
  "minecraftVersion": "1.21.11",
  "fabricVersion": "0.19.5",
  "fabricApiVersion": "0.141.6+1.21.11",
  "javaVersion": 21,
  "releaseDate": "2026-10-04",
  "channel": "stable",
  "files": [
    {
      "name": "vanta-client-1.0.0.jar",
      "downloadUrl": "https://github.com/vanta-client/vanta/releases/download/client-v1.0.0/vanta-client-1.0.0.jar",
      "size": 1835008,
      "sha256": "43af029f14abd60e022d50e036ac7398856997f6d1e759c815c277cded0812e1"
    }
  ],
  "changelog": "website/content/changelog/client-1.0.0.md"
}