{
  "schemaVersion": 1,
  "product": "launcher",
  "version": "1.4.1",
  "minecraftVersion": "1.21.11",
  "fabricVersion": "0.19.5",
  "fabricApiVersion": "0.141.6+1.21.11",
  "javaVersion": 21,
  "releaseDate": "2026-10-09",
  "channel": "stable",
  "files": [
    {
      "name": "VANTA-Launcher-1.4.1.msi",
      "downloadUrl": "https://github.com/LennardOwnTest123006/VANTA-Client/releases/download/launcher-v1.4.1/VANTA-Launcher-1.4.1.msi",
      "size": 67175449,
      "sha256": "9c44ad39c5215ae1829f132f9ec50186d7cea7af2a8d3257e04512cf7c94a0d0"
    },
    {
      "name": "VANTA-Launcher-1.4.1-windows-portable.zip",
      "downloadUrl": "https://github.com/LennardOwnTest123006/VANTA-Client/releases/download/launcher-v1.4.1/VANTA-Launcher-1.4.1-windows-portable.zip",
      "size": 65366972,
      "sha256": "93e8ee6ac339295592fa18a44a38ec8cbdea519648d2491615cd4a3a8c2aa204"
    },
    {
      "name": "vanta-launcher-1.4.1-windows-all.jar",
      "downloadUrl": "https://github.com/LennardOwnTest123006/VANTA-Client/releases/download/launcher-v1.4.1/vanta-launcher-1.4.1-windows-all.jar",
      "size": 14549991,
      "sha256": "61d5478a07fc9865d1b6a858f056bc718d9ef7132725430b844504f3a44e87d7"
    },
    {
      "name": "VANTA-Launcher-1.4.1-linux-x64.tar.gz",
      "downloadUrl": "https://github.com/LennardOwnTest123006/VANTA-Client/releases/download/launcher-v1.4.1/VANTA-Launcher-1.4.1-linux-x64.tar.gz",
      "size": 67178275,
      "sha256": "738741974d79eed89b719dc0eb3d0dac86f73ec4040a592b383e5f63f6f25172"
    },
    {
      "name": "vanta-launcher-1.4.1-linux-all.jar",
      "downloadUrl": "https://github.com/LennardOwnTest123006/VANTA-Client/releases/download/launcher-v1.4.1/vanta-launcher-1.4.1-linux-all.jar",
      "size": 13323109,
      "sha256": "c7af52b3b3f4b855f5989cbdbda5a239283f83987824cce0ebc9c239fc28dd95"
    },
    {
      "name": "vanta-launcher-1.4.1-macos-aarch64-all.jar",
      "downloadUrl": "https://github.com/LennardOwnTest123006/VANTA-Client/releases/download/launcher-v1.4.1/vanta-launcher-1.4.1-macos-aarch64-all.jar",
      "size": 13409934,
      "sha256": "4a03d462f62e4fc9adbf154c82ef488f3cc376155e397d67de087c2265235e1b"
    }
  ],
  "changelog": "website/content/changelog/launcher-1.4.1.md"
}
